<?xml version="1.0"?>
<!--
	HA-JDBC: High-Availability JDBC
	Copyright 2004-2009 Paul Ferraro
	
	This program is free software: you can redistribute it and/or modify
	it under the terms of the GNU Lesser General Public License as published by
	the Free Software Foundation, either version 3 of the License, or
	(at your option) any later version.
	
	This program is distributed in the hope that it will be useful,
	but WITHOUT ANY WARRANTY; without even the implied warranty of
	MERCHANTABILITY or FITNESS FOR A PARTICULAR PURPOSE.  See the
	GNU Lesser General Public License for more details.

	You should have received a copy of the GNU Lesser General Public License
	along with this program.  If not, see <http://www.gnu.org/licenses/>.
-->
<!--DOCTYPE ha-jdbc SYSTEM "../doc/src/content/xdocs/dtd/ha-jdbc-2.0.dtd"-->
<!--ha-jdbc xmlns="http://ha-jdbc.sourceforge.net" xmlns:xsi="http://www.w3.org/2001/XMLSchema-instance" xsi:schemaLocation="http://ha-jdbc.sourceforge.net ../doc/src/content/xdocs/xsd/ha-jdbc-2.0.xsd"-->
<ha-jdbc>
	<sync id="diff" class="net.sf.hajdbc.sync.DifferentialSynchronizationStrategy">
		<property name="fetchSize">100</property>
		<property name="maxBatchSize">50</property>
	</sync>
	<cluster balancer="simple" default-sync="diff" meta-data-cache="none" transaction-mode="parallel">
		<database id="database1" weight="1">
			<driver>net.sf.hajdbc.sql.MockDriver</driver>
			<url>jdbc:mock:database1</url>
			<property name="ssl">true</property>
			<user>root</user>
			<password>password</password>
		</database>
		<database id="database2" weight="2">
			<driver>net.sf.hajdbc.sql.MockDriver</driver>
			<url>jdbc:mock:database2</url>
			<user>root</user>
		</database>
	</cluster>
</ha-jdbc>
